{
  "name": "Test NFT.Storage Metaplex NFT",
  "symbol": "PLTEST",
  "description": "Just a test, nothing to see here",
  "seller_fee_basis_points": 0,
  "image": "",
  "properties": {
    "files": [
      {
        "uri": "token.png",
        "type": "image/png"
      }
    ],
    "category": "image",
    "creators": [
      {
        "address": "3eoKfwCQ4jMBD5CEpLM8aCTZVN7wGQ9KTUBHhksmaZNh",
        "share": 100
      }
    ]
  }
}
